{
  "schemaVersion": "modeleaf.w02.evidence.v1",
  "recordId": "w02-print",
  "recordType": "print",
  "recordedAt": "2026-08-16T16:05:16.6847036Z",
  "machine": {
    "id": "reference-workstation-2026-08-16",
    "os": "Windows 11 Enterprise",
    "build": "Microsoft Windows NT 10.0.26200.0",
    "arch": "x64",
    "cpu": "Intel(R) Core(TM) Ultra 5 125H",
    "ramBytes": 33838469120,
    "gpu": "Intel(R) Arc(TM) Graphics",
    "webview2": "151.0.4129.86"
  },
  "app": {
    "name": "Modeleaf",
    "version": "0.1.0",
    "commit": "f306207e3ceab329c9f496a79c74142fc441222f",
    "dirty": true,
    "buildProfile": "debug",
    "sourceTreeSha256": "e6867ef09514b607d72b8e9dd87f89523b37a52cfff0f458481792c397dbb10e",
    "binarySha256": "b5e674fc902fc038f44bc13568228c79531ee1d7f3db812c4cf1c21ae6bf1e73",
    "pdfjsVersion": "6.2.108"
  },
  "fixture": {
    "id": "text-3-page.pdf",
    "sha256": "2d7cb2cb8d7ae1eb5f6377af387cdc4aff0e1d94010b257ebc4ecefe46fcf1bd",
    "bytes": 1539
  },
  "sourceHashes": {
    "before": "2d7cb2cb8d7ae1eb5f6377af387cdc4aff0e1d94010b257ebc4ecefe46fcf1bd",
    "after": "2d7cb2cb8d7ae1eb5f6377af387cdc4aff0e1d94010b257ebc4ecefe46fcf1bd"
  },
  "result": "pass",
  "details": {
    "nativeDialogOpened": true,
    "pageCount": 3,
    "trustedCancel": true,
    "surfaceRemoved": true,
    "objectUrlsRevoked": true,
    "backingReleased": true,
    "duplicateRejected": true,
    "renderAbortCovered": true,
    "errorCleanupCovered": true,
    "readerStatePreserved": true,
    "sourceUnchanged": true
  },
  "artifactRefs": [
    {
      "path": "artifacts/print.json",
      "sha256": "67f8505d67048833138495c215ef48b5d3f077aa1c1230f5dc60a12570bccd4b",
      "bytes": 1346
    }
  ]
}
