{
  "schemaVersion": "modeleaf.w02.evidence.v1",
  "recordId": "w02-transport",
  "recordType": "transport",
  "recordedAt": "2026-08-16T16:05:16.6847036Z",
  "machine": {
    "id": "reference-workstation-2026-08-16",
    "os": "Windows 11 Enterprise",
    "build": "Microsoft Windows NT 10.0.26200.0",
    "arch": "x64",
    "cpu": "Intel(R) Core(TM) Ultra 5 125H",
    "ramBytes": 33838469120,
    "gpu": "Intel(R) Arc(TM) Graphics",
    "webview2": "151.0.4129.86"
  },
  "app": {
    "name": "Modeleaf",
    "version": "0.1.0",
    "commit": "d119104090e18141924e44dd55063d63f070a499",
    "dirty": false,
    "buildProfile": "debug",
    "sourceTreeSha256": "e6867ef09514b607d72b8e9dd87f89523b37a52cfff0f458481792c397dbb10e",
    "binarySha256": "b5e674fc902fc038f44bc13568228c79531ee1d7f3db812c4cf1c21ae6bf1e73",
    "pdfjsVersion": "6.2.108"
  },
  "fixture": {
    "id": "fixture-F-raster-12.pdf",
    "sha256": "53cfe725923b584062ecd1082611b4c38105f7c58c0251966af47ad7718682dc",
    "bytes": 33665980
  },
  "sourceHashes": {
    "before": "53cfe725923b584062ecd1082611b4c38105f7c58c0251966af47ad7718682dc",
    "after": "53cfe725923b584062ecd1082611b4c38105f7c58c0251966af47ad7718682dc"
  },
  "result": "pass",
  "details": {
    "headStatus": 200,
    "fullGetStatus": 200,
    "rangeStatus": 206,
    "initialRange": "bytes=0-1048575",
    "probeBodyBytes": 1048576,
    "probeContentLength": 1048576,
    "maxAcceptedRangeBytes": 4194304,
    "firstRejectedRangeBytes": 4194305,
    "rangeBeforeComplete": true,
    "invalidRangeStatus": 416,
    "multiRangeStatus": 416,
    "eofRangeStatus": 416,
    "overflowRangeStatus": 416,
    "overLimitRangeStatus": 416,
    "wrongOwnerStatus": 404,
    "staleGenerationStatus": 404,
    "closingStatus": 404,
    "capacityStatus": 503,
    "ioFailureStatus": 500,
    "cancellationCovered": true,
    "sourceUnchanged": true
  },
  "artifactRefs": [
    {
      "path": "artifacts/transport.json",
      "sha256": "4fc40feae89e63242cb36563e31d853253292c26fc62de5f73f3a59a581d841a",
      "bytes": 2314
    }
  ]
}
