{
  "schemaVersion": "modeleaf.w02.evidence.v1",
  "recordId": "w02-resource",
  "recordType": "resource",
  "recordedAt": "2026-08-16T16:05:16.6847036Z",
  "machine": {
    "id": "reference-workstation-2026-08-16",
    "os": "Windows 11 Enterprise",
    "build": "Microsoft Windows NT 10.0.26200.0",
    "arch": "x64",
    "cpu": "Intel(R) Core(TM) Ultra 5 125H",
    "ramBytes": 33838469120,
    "gpu": "Intel(R) Arc(TM) Graphics",
    "webview2": "151.0.4129.86"
  },
  "app": {
    "name": "Modeleaf",
    "version": "0.1.0",
    "commit": "d119104090e18141924e44dd55063d63f070a499",
    "dirty": false,
    "buildProfile": "debug",
    "sourceTreeSha256": "e6867ef09514b607d72b8e9dd87f89523b37a52cfff0f458481792c397dbb10e",
    "binarySha256": "b5e674fc902fc038f44bc13568228c79531ee1d7f3db812c4cf1c21ae6bf1e73",
    "pdfjsVersion": "6.2.108"
  },
  "fixture": {
    "id": "fixture-S-text-10.pdf",
    "sha256": "c8f5e6331212d02864333a7d58b7dee804f1c8a1f51b32451d16a50cd84ffdfa",
    "bytes": 4403
  },
  "sourceHashes": {
    "before": "c8f5e6331212d02864333a7d58b7dee804f1c8a1f51b32451d16a50cd84ffdfa",
    "after": "c8f5e6331212d02864333a7d58b7dee804f1c8a1f51b32451d16a50cd84ffdfa"
  },
  "result": "pass",
  "details": {
    "text10ColdMs": 274.2669,
    "text10WarmMs": 276.8193,
    "text300ColdMs": 319.3479,
    "text300WarmMs": 263.0734,
    "navigationMs": 59544.9056,
    "idleMs": 15000,
    "maximumMountedCanvases": 5,
    "maximumActiveRenderTasks": 1,
    "maximumResidentDistanceFromActivePage": 2,
    "residentWindowInvariantCovered": true,
    "unmountedRenderCancelled": true,
    "longTasksOver100Ms": 0,
    "workingSetStartBytes": 586665984,
    "workingSetPeakBytes": 681803776,
    "workingSetPostIdleBytes": 611889152,
    "declinedFromPeak": true,
    "cancelledBackingReleased": true
  },
  "artifactRefs": [
    {
      "path": "artifacts/resources.json",
      "sha256": "8819885bd821bf5030281436f67e424e0e7bfdac77b1a914833ca9be39140c71",
      "bytes": 2151
    }
  ]
}
