{
  "schemaVersion": "modeleaf.w02.evidence.v1",
  "recordId": "w02-capability",
  "recordType": "capability",
  "recordedAt": "2026-08-16T16:05:16.6847036Z",
  "machine": {
    "id": "reference-workstation-2026-08-16",
    "os": "Windows 11 Enterprise",
    "build": "Microsoft Windows NT 10.0.26200.0",
    "arch": "x64",
    "cpu": "Intel(R) Core(TM) Ultra 5 125H",
    "ramBytes": 33838469120,
    "gpu": "Intel(R) Arc(TM) Graphics",
    "webview2": "151.0.4129.86"
  },
  "app": {
    "name": "Modeleaf",
    "version": "0.1.0",
    "commit": "f306207e3ceab329c9f496a79c74142fc441222f",
    "dirty": true,
    "buildProfile": "debug",
    "sourceTreeSha256": "e6867ef09514b607d72b8e9dd87f89523b37a52cfff0f458481792c397dbb10e",
    "binarySha256": "b5e674fc902fc038f44bc13568228c79531ee1d7f3db812c4cf1c21ae6bf1e73",
    "pdfjsVersion": "6.2.108"
  },
  "fixture": {
    "id": "interactive.pdf",
    "sha256": "615c7af32350c2372d3489fe91d132ca5a6ef60e814a37c2d0bb27b0071636f5",
    "bytes": 1539
  },
  "sourceHashes": {
    "before": "615c7af32350c2372d3489fe91d132ca5a6ef60e814a37c2d0bb27b0071636f5",
    "after": "615c7af32350c2372d3489fe91d132ca5a6ef60e814a37c2d0bb27b0071636f5"
  },
  "result": "pass",
  "details": {
    "localWorkerObserved": true,
    "allSupportAssetsBundled": true,
    "externalNetworkResources": 0,
    "interactiveFormsSuppressed": true,
    "interactiveMediaSuppressed": true,
    "pdfScriptsExecuted": false,
    "imageOnlyOcrObserved": false,
    "malformedHealthyDocumentPreserved": true,
    "lockedCancelDiagnostic": "Opening PDF cancelled."
  },
  "artifactRefs": [
    {
      "path": "artifacts/capabilities.json",
      "sha256": "3f035d2f07335abe4ddd569bcf233ee6f6a267c077bb097da205dc0a7216b600",
      "bytes": 3079
    }
  ]
}
